<?xml version="1.0" encoding="UTF-8"?>
<entities xmlns:xsi="http://www.w3.org/2001/XMLSchema-instance"
          xmlns="http://www.training.by/serials"
          xsi:schemaLocation="http://www.training.by/serials serials.xsd">
    <user role="1">
        <id>0</id>
        <login>admin</login>
        <password>admin</password>
        <user-info>
            <phone-num>808005553535</phone-num>
            <birth-date>1990-10-11</birth-date>
            <sex>man</sex>
        </user-info>
    </user>

    <serial>
        <id>2</id>
        <name>Сверхъестественное</name>
        <premiere-date>2005-09-13</premiere-date>
        <image_path>supernatural.png</image_path>
        <description>
            Сверхъестественное — мистический сериал, который рассказывает о братьях-охотниках,
            вынужденных истреблять разного рода нечисть в виде демонов, призраков, вампиров и оборотней.
            Сэм и Дин Винчестеры путешествуют по Америке на легендарной Chevrolet Impala 1967 года,
            а явления, с которыми сталкиваются братья, основаны на реальных городских легендах и фольклоре.
        </description>
        <country>США</country>
        <category>Фэнтези</category>
    </serial>

    <user role="2">
        <id>104</id>
        <login>someUser</login>
        <password>pass1234</password>
        <user-info>
            <phone-num>80332220456</phone-num>
            <birth-date>1995-04-06</birth-date>
            <sex>woman</sex>
        </user-info>
    </user>
</entities>
